{
  "$schema": "../schema/SecOC.schema.json",
  "module": "SecOC",
  "rxPduCountDoc": [
    "RX Secured I-PDU テーブルのエントリ数",
    "[0]=ImmobilizerCmd (CAN 0x120, KeyFobEcu からの想定)"
  ],
  "txPduCountDoc": [
    "TX Secured I-PDU テーブルのエントリ数。現在 TX 方向で SecOC を使う PDU は",
    "無い（以前は E2EHealthStatus (CAN 0x220) を保護していたが、E2E Profile05",
    "単体保護へ切り替えて撤去した）。RX 方向 (ImmobilizerCmd) は引き続き使用中。"
  ],
  "rxPdus": [
    {
      "name": "ImmobilizerCmd_Rx",
      "frame": "SecureCommand (ImmobilizerCmd)",
      "title": "ImmobilizerCmd",
      "comIpdu": "SecureCommand_Rx",
      "csmJobId": "CSM_JOB_ID_IMMOBILIZER_CMD_VERIFY",
      "verificationStatusCallout": "Rte_SecOCVerificationStatus_ImmobilizerCmd",
      "verificationStatusPropagationMode": "SECOC_VERIFICATION_STATUS_PROPAGATION_BOTH",
      "comments": {
        "secOCRxPduId": ["PduR_PBCfg.c の該当 RxDest.DestPduId と同じシンボル"],
        "dataId": [
          "SecOCDataId。CAN ID と同値にして",
          "対応関係を分かりやすくする（E2E の",
          "DataID 割り当てと同じ方針）"
        ],
        "authenticPduLength": ["byte[0]=ImmobilizerCmd, byte[1]=Reserved"],
        "freshnessLength": ["8bit、切り詰めなし（SecOC_Types.h 参照）"],
        "macTxLength": ["24bit（SecOC Profile 1）"],
        "securedPduLength": ["2 + 1 + 3"]
      }
    }
  ]
}
